projectId,projectTitle,funderId,funderName,country,countryCode,region,city,projectType,secondaryProjectTypes,sector,subsector,technologyType,approvalDate,closingDate,projectStatus,capacityOrScale,capacityValue,capacityUnit,totalBudgetUsd,primaryFunderAmountUsd,financingInstrument,coFinanciers,irr,npvUsd,paymentPerTco2eUsd,financingNotes,expectedEmissionReductionTco2ePerYear,totalEmissionReductionTco2e,verifiedEmissionReductionTco2e,accountingPeriodYears,baselineDescription,mrvApproach,actionsImplemented,policyOrRegulatoryChanges,institutionalArrangements,primaryBeneficiaries,estimatedBeneficiaryCount,coBenefits,projectSummary,keyInterventions,keyRisks,replicabilityConditions,lessonsLearned,evidenceAnchors,synthesisNotes,siteContext.geography,siteContext.resourceConditions,siteContext.infrastructureContext,siteContext.environmentalConditions,siteContext.notes,financingStructure.grant_pct,financingStructure.loan_pct,financingStructure.private_pct,financingStructure.government_pct,financingStructure.notes,dataCompleteness.hasCapacityData,dataCompleteness.hasEmissionReductionData,dataCompleteness.hasFinancingStructure,dataCompleteness.hasSiteContext,dataCompleteness.hasActionsImplemented,dataCompleteness.missingKeyFields,pdf_url,project_url
FP100,REDD-PLUS results-based payments for results achieved by Brazil in the Amazon biome in 2014 and 2015,gcf,Green Climate Fund,Brazil,BR,,,programmatic,[],land_use_forestry,redd_plus,results_based_payment,2019-02-28 0:00:00,2021-01-14 0:00:00,under_implementation,,,,96452228,96452228,results_based_payment,[],,,,,,,,2,GHG emissions from deforestation in the Amazon biome in 2014 and 2015 were used as the baseline for calculating REDD+ results.,GHG emissions from deforestation were monitored and reported in Brazil’s REDD+ Technical Annexes submitted to the UNFCCC.,"[{'action': 'Establishment of beneficiary registration and digital monitoring platform for Floresta+ M1 and M2', 'scale': None, 'status': 'in_progress'}, {'action': 'Direct payments to small rural landowners and land users for forest conservation and recovery', 'scale': '6 initial payments in pilot phase; project-wide, up to 797 (M1) and 1,239 (M2) eligible beneficiaries', 'status': 'in_progress'}, {'action': 'Finalization of ESIA and ESMP for the project', 'scale': None, 'status': 'completed'}, {'action': 'Development of Floresta+ Operations Manual and M&E Plan with gender and safeguards measures', 'scale': None, 'status': 'completed'}, {'action': 'Capacity building and participatory workshops with over 300 participants', 'scale': 'over 300 participants', 'status': 'completed'}, {'action': 'Development and initial implementation of outreach and CAR acceleration strategies', 'scale': None, 'status': 'in_progress'}]",Implementation of the Floresta+ program operational instruments and monitoring provisions under national REDD+ framework.,"Project Advisory Committee (PAC) established with 11 government and civil society members. Project Board (PB) includes UNDP, MMA, and ABC as decision-making members.","Small rural landowners and land users with validated CAR in the Amazon biome, including Indigenous Peoples and Local Communities (IPLCs).",2036,"['biodiversity', 'income_generation', 'gender_inclusion', 'capacity_building', 'territorial_management']","This GCF-funded project supports Brazil’s achievement of REDD+ emission reduction results in the Amazon biome for 2014 and 2015 via results-based payments. It implements the Floresta+ program, providing direct incentives to over 2,000 eligible small landholders and IPLCs for forest conservation and restoration, with a focus on gender inclusion, monitoring, and capacity-building. The project delivers payments and technical support, strengthens environmental management, and develops digital tools for beneficiary tracking.","['Direct payments for forest conservation (Floresta+ M1)', 'Direct payments for recovery of Permanent Preservation Areas (Floresta+ M2)', 'Development of digital platform for beneficiary registration and monitoring', 'Stakeholder engagement through workshops and outreach', 'Capacity building and gender-sensitive interventions']","[{'type': 'capacity', 'risk': 'Limited number of eligible beneficiaries due to CAR data validation reduces project reach'}, {'type': 'governance', 'risk': 'COVID-19 restrictions caused operational delays and required activities to shift to virtual formats'}]","['Presence of an operational rural environmental cadaster (such as CAR)', 'Legal and technical framework for REDD+ results-based payments', 'Ability to reach smallholders and IPLCs in remote areas', 'Digital infrastructure/tool for beneficiary tracking and monitoring']",Accurate and accessible land tenure and environmental registration are crucial for inclusive beneficiary targeting. COVID-19 highlighted the need for flexible stakeholder engagement and adaptable project management. Gender data gaps require innovative estimation methods.,"[{'field': 'totalBudgetUsd', 'claim': 'The total cumulative project disbursement up to this reporting period is 96,452,228 USD.', 'pageOrSection': 'Page 22', 'sourceName': 'annual performance', 'evidenceKind': 'quantitative'}, {'field': 'primaryFunderAmountUsd', 'claim': 'The cumulative GCF results-based payment disbursement up to this reporting period is 96,452,228 USD.', 'pageOrSection': 'Page 22', 'sourceName': 'annual performance', 'evidenceKind': 'quantitative'}, {'field': 'financingStructure.grant_pct', 'claim': 'Floresta+ is expected to deliver 77% of the total project budget as economic incentives to beneficiaries.', 'pageOrSection': 'Page 4', 'sourceName': 'annual performance', 'evidenceKind': 'quantitative'}, {'field': 'financingStructure.government_pct', 'claim': '40% allocation to the federal government.', 'pageOrSection': 'Page 30', 'sourceName': 'annual performance', 'evidenceKind': 'quantitative'}, {'field': 'estimatedBeneficiaryCount', 'claim': '797 beneficiaries for M1 and 1,239 for M2 currently have CAR validated.', 'pageOrSection': 'Page 17', 'sourceName': 'annual performance', 'evidenceKind': 'quantitative'}, {'field': 'accountingPeriodYears', 'claim': 'Payments are for REDD+ results in 2014 and 2015 (2 years).', 'pageOrSection': 'project title and annual performance', 'sourceName': 'annual performance', 'evidenceKind': 'categorical'}]","Emission reduction data (quantitative tCO2e) is absent — only qualitative descriptions of REDD+ results are available. Capacity or scale is not provided in hectares, tCO2e, or similar metrics in the evidentiary record. Financing structure percentages are only partly reconstructable (grant/incentives and government share); loan, private, and full breakdowns cannot be inferred. Total beneficiary count sums eligible M1 and M2 from strongest evidence. No co-financiers found. Secondary project types and detailed technology type cannot be substantiated from the available data.",Amazon biome,native tropical forest; subject to deforestation pressures,Beneficiaries identified by validated CAR (Rural Environmental Cadaster) data; digital monitoring platform under development,,"Access to project benefits depends on status in the CAR system, which limits eligible beneficiaries.",0.77,,,0.4,"77% of the total project budget allocated as economic incentives to beneficiaries (annual performance, Page 4); 40% of results-based payments allocated to the federal government (annual performance, Page 30).",FALSE,FALSE,TRUE,TRUE,TRUE,"['capacityOrScale', 'capacityValue', 'capacityUnit', 'expectedEmissionReductionTco2ePerYear', 'totalEmissionReductionTco2e', 'verifiedEmissionReductionTco2e', 'irr', 'npvUsd', 'paymentPerTco2eUsd']",https://www.greenclimate.fund/sites/default/files/document/fp100-annual-performance-report-cy2021-v.pdf,https://www.greenclimate.fund/project/FP100
FP143,Planting Climate Resilience in Rural Communities of the Northeast (PCRP),gcf,Green Climate Fund,Brazil,BR,Northeastern Brazil,,programmatic,[],land_use_forestry,sustainable_forest_management,,2020-11-13 0:00:00,2031-06-12 0:00:00,under_implementation,,,,202500000,99500000,,[],,,,,,,,,,,[],,International Fund for Agricultural Development (IFAD) is the accredited and implementing entity.,,,[],"The Planting Climate Resilience in Rural Communities of the Northeast (PCRP) project is implemented in Northeastern Brazil and targets rural communities. It aims to build climate resilience, with the International Fund for Agricultural Development (IFAD) as the implementing entity.",[],[],[],,"[{'field': 'projectTitle', 'claim': ""The project's title is Planting Climate Resilience in Rural Communities of the Northeast (PCRP)."", 'pageOrSection': 'Page 1', 'sourceName': 'other', 'evidenceKind': 'categorical'}, {'field': 'region', 'claim': 'The project is located in Northeastern Brazil.', 'pageOrSection': 'Page 2', 'sourceName': 'other', 'evidenceKind': 'categorical'}, {'field': 'projectStatus', 'claim': ""Status is 'Under Implementation'."", 'pageOrSection': None, 'sourceName': 'catalog', 'evidenceKind': 'categorical'}, {'field': 'approvalDate', 'claim': 'Project approval date is 2020-11-13.', 'pageOrSection': None, 'sourceName': 'catalog', 'evidenceKind': 'categorical'}, {'field': 'closingDate', 'claim': 'Project closing date is 2031-06-12.', 'pageOrSection': None, 'sourceName': 'catalog', 'evidenceKind': 'categorical'}, {'field': 'totalBudgetUsd', 'claim': 'Total project cost is 202,500,000 USD.', 'pageOrSection': None, 'sourceName': 'catalog', 'evidenceKind': 'quantitative'}, {'field': 'primaryFunderAmountUsd', 'claim': 'GCF total commitment is 99,500,000 USD.', 'pageOrSection': None, 'sourceName': 'catalog', 'evidenceKind': 'quantitative'}, {'field': 'institutionalArrangements', 'claim': 'The International Fund for Agricultural Development (IFAD) is the implementing entity.', 'pageOrSection': 'Page 1', 'sourceName': 'other', 'evidenceKind': 'categorical'}]","Sector and subsector classified as 'land_use_forestry' and 'sustainable_forest_management' based on project title and regional context referencing planting resilience in rural, Northeastern Brazil but would benefit from more explicit intervention details. ProjectType set to 'programmatic' due to rural and resilience-building focus. Financing instrument and structure not specified in evidence. No emission or beneficiary data present. All intervention/action fields unpopulated due to lack of direct evidence.",Northeastern Brazil; likely includes rural and agricultural areas (from project scope),,,,,,,,,,FALSE,FALSE,FALSE,TRUE,FALSE,"['capacityOrScale', 'expectedEmissionReductionTco2ePerYear', 'totalEmissionReductionTco2e', 'verifiedEmissionReductionTco2e', 'mrvApproach', 'actionsImplemented', 'policyOrRegulatoryChanges', 'primaryBeneficiaries', 'estimatedBeneficiaryCount', 'coBenefits', 'keyInterventions', 'keyRisks']",https://www.greenclimate.fund/sites/default/files/document/fp143-ifad-brazil.pdf,https://www.greenclimate.fund/project/FP143
FP151,Global Subnational Climate Fund (SnCF Global) – Technical Assistance (TA) Facility,gcf,Green Climate Fund,Albania,AL,,,technical_assistance,[],policy,climate_mitigation_technical_assistance,,2020-11-13 0:00:00,2027-10-20 0:00:00,under_implementation,"Technical assistance for up to 50 pre-feasibility studies, 40 feasibility studies, and support for 40 projects",40,projects,28000000,18500000,grant,[],,,0.3606647112,,,77634432,,,Baseline emissions reductions are set to 0 tCO2eq; emission reductions will only accrue as projects are developed and implemented.,Certification of Climate Project SDG and Nature-based Solutions (NbS) impacts planned; specific MRV approach not described.,"[{'action': 'Develop and agree on technical assistance selection criteria', 'scale': None, 'status': 'completed'}, {'action': 'Conduct market studies and develop submission tools', 'scale': None, 'status': 'in_progress'}, {'action': 'Perform on-site evaluation, stakeholder meetings, and pre-feasibility studies', 'scale': '6 pre-feasibility studies completed', 'status': 'completed'}, {'action': 'Draft and negotiate contracts for technical assistance support', 'scale': None, 'status': 'in_progress'}, {'action': 'Perform additional Environmental and Social Safeguard assessments', 'scale': None, 'status': 'in_progress'}, {'action': 'Establish internal NbS and capacity-building working groups', 'scale': None, 'status': 'completed'}]",Institutional and regulatory systems for low-emission planning and development strengthened via training and capacity building.,"Technical Assistance executed by R20, IUCN, and Gold Standard; Project Management Unit coordinated by R20; Steering Committee revised to include CEO-level members.",Direct project developers and sub-national authorities receiving technical assistance; indirect beneficiaries are citizens benefiting from improved infrastructure and services.,20000,"['jobs', 'public_health', 'energy_security', 'water_security', 'biodiversity']","This technical assistance facility, funded by the Green Climate Fund and implemented in Albania, supports sub-national climate mitigation projects by developing selection criteria, conducting pre-feasibility and feasibility studies, and strengthening institutional capacity. The project aims to catalyze up to 40 climate mitigation infrastructure projects and deliver over 77 million tCO2eq emission reductions over its lifetime, benefiting up to 20,000 direct and millions of indirect beneficiaries.","['Development of project selection criteria and tools', 'Market and barrier studies', 'Pre-feasibility and feasibility studies for climate infrastructure projects', 'Environmental and Social Safeguard (ESS) assessments', 'Capacity building and training for sub-national stakeholders', 'Establishment of governance processes and project management units']","[{'type': 'capacity', 'risk': 'COVID-19 restrictions delayed pipeline and stakeholder engagement'}, {'type': 'governance', 'risk': 'Delays in establishing operational manuals and finalizing selection criteria'}, {'type': 'regulatory', 'risk': 'Potential delays in contract finalization and stakeholder approvals'}]","['Availability of project developers able to submit climate infrastructure concepts', 'Capacity for sub-national authority participation in technical assistance', 'Access to GCF or other concessional finance for technical assistance', 'Project environments where regulatory approvals for ESS activities can be secured']","Strengthening and continuous refinement of selection criteria and project pipeline processes are key to effective technical assistance delivery. Adaptability in implementation, including development of virtual tools and management structures, is essential under unforeseen disruptions such as COVID-19.","[{'field': 'totalBudgetUsd', 'claim': 'Total project cost is 28,000,000 USD.', 'pageOrSection': 'Page 25', 'sourceName': 'annual performance', 'evidenceKind': 'quantitative'}, {'field': 'primaryFunderAmountUsd', 'claim': 'GCF funding is 18,500,000 USD.', 'pageOrSection': 'Page 25', 'sourceName': 'annual performance', 'evidenceKind': 'quantitative'}, {'field': 'financingStructure', 'claim': 'GCF funding is 18,500,000 USD, co-financing is 9,500,000 USD out of total 28,000,000 USD.', 'pageOrSection': 'Page 25', 'sourceName': 'annual performance', 'evidenceKind': 'quantitative'}, {'field': 'paymentPerTco2eUsd', 'claim': 'Estimated cost per tCO2eq reduced is 0.36 USD.', 'pageOrSection': 'Page 25', 'sourceName': 'annual performance', 'evidenceKind': 'quantitative'}, {'field': 'totalEmissionReductionTco2e', 'claim': 'Final target emission reduction is 77,634,432 tCO2eq.', 'pageOrSection': 'Page 24', 'sourceName': 'annual performance', 'evidenceKind': 'quantitative'}, {'field': 'estimatedBeneficiaryCount', 'claim': 'Project aims to have 20,000 direct beneficiaries, 50% female.', 'pageOrSection': 'Page 25', 'sourceName': 'annual performance', 'evidenceKind': 'quantitative'}, {'field': 'capacityOrScale', 'claim': 'Support for up to 40 infrastructure projects, 50 pre-feasibility studies, 40 feasibility studies targeted by final stage.', 'pageOrSection': 'Pages 29-31', 'sourceName': 'annual performance', 'evidenceKind': 'quantitative'}]","Project is multi-country/global with Albania as catalog anchor; most results, emissions and beneficiaries are reported at program level—not exclusively for Albania. Financing structure is calculated only from GCF and confirmed co-finance, as per evidence; co-financiers are not named. Detailed site context and annual emission reduction data are missing.",,,,,,0.66,,0.34,,"Based on 18,500,000 USD from GCF (grant) and 9,500,000 USD confirmed co-financing.",TRUE,TRUE,TRUE,FALSE,TRUE,"['siteContext.geography', 'siteContext.resourceConditions', 'siteContext.infrastructureContext', 'siteContext.environmentalConditions', 'expectedEmissionReductionTco2ePerYear', 'irr', 'npvUsd', 'verifiedEmissionReductionTco2e', 'accountingPeriodYears', 'technologyType', 'coFinanciers']",https://www.greenclimate.fund/sites/default/files/document/fp151-annual-performance-report-cy2021-v.pdf,https://www.greenclimate.fund/project/FP151
FP152,Global Subnational Climate Fund (SnCF Global) – Equity,gcf,Green Climate Fund,Cote d'Ivoire,CI,,,blended,['programmatic'],policy,climate_investment_fund,,2020-11-13 0:00:00,2028-04-20 0:00:00,under_implementation,,,,750000000,150000000,blended,[],,,,"Fundraising slower than expected due to COVID-19 and blended structure; private co-financing is targeted but not fully closed. No grant/loan elements in the main structure. GCF is first-loss equity, private is senior equity. No explicit co-financier institutions are listed in available evidence.",,77634432,,,"Baseline and current emission reductions are zero; emission reductions accrue only once investments are made (Page 13, annual performance).","One MRV system to be established integrating SnCF MRV criteria, reporting pathways, and impact registry by mid-term (Page 17, annual performance).","[{'action': 'Structured SnCF Global as a Luxembourg limited partnership including formation of general partner and contracts with licensed AIFM', 'scale': None, 'status': 'completed'}, {'action': 'Hired staff and advisors, established a global placement agent', 'scale': '4 employees hired; BEIT Capital as placement agent', 'status': 'completed'}, {'action': 'Drafted prospectus and investor presentation', 'scale': None, 'status': 'completed'}, {'action': 'Pipeline development, investment due diligence, and stakeholder outreach', 'scale': 'over 100 investments evaluated; 29 active; 5–6 in enhanced due diligence', 'status': 'in_progress'}, {'action': 'Organized annual audit and set up verification mechanisms', 'scale': None, 'status': 'in_progress'}]",,"SnCF Global is a limited partnership in Luxembourg with a general partner; contracts with licensed Luxembourg AIFM; operating partners and legal counsel engaged for fund management, structuring, and compliance (Page 6-7, annual performance).",Direct and indirect beneficiaries of supported climate mitigation projects in subnational areas,17000000,"['jobs', 'gender_equality', 'biodiversity', 'climate_adaptation']","The Global Subnational Climate Fund (SnCF Global) – Equity, supported by the Green Climate Fund, is a blended finance facility targeting climate mitigation infrastructure investments across subnational regions, with Cote d'Ivoire as one participant. The project aims to raise a $750 million fund (including $150 million GCF equity and $600 million private co-financing) and invest in 20–35 climate mitigation sub-projects, targeting 77.6 million tCO2e lifetime emission reductions and up to 17 million indirect beneficiaries. To date, organizational structuring, staffing, and pipeline development are in progress, with initial due diligence on priority investments underway.","['Establishment of blended finance climate fund structure', 'Pipeline development and due diligence of climate investment projects', 'Stakeholder outreach and fundraising from private/DFI co-investors', 'Adoption of gender action plan, ESMS, and impact measurement', 'Portfolio management and MRV system implementation']","[{'type': 'market', 'risk': 'Slower than expected fundraising due to COVID-19 disruptions, blended finance structure unfamiliarity, and diversity of investment targets.'}, {'type': 'governance', 'risk': 'Dependence on GCF first-loss tranche to attract private sector co-investors.'}, {'type': 'capacity', 'risk': 'Potential pipeline projects may not reach investment readiness or meet fund criteria.'}]","['Availability of subnational project pipelines suitable for climate investment', 'Willingness of public and private investors to invest in blended structures', 'Host country NDAs and regulatory frameworks accommodating for subnational project finance', 'Access to legal and fund management expertise for fund structuring']","Fundraising for blended climate investment vehicles is challenged by market unfamiliarity and external shocks (COVID-19), requiring persistent outreach, adaptive structuring, and institutional flexibility.","[{'field': 'totalBudgetUsd', 'claim': 'Target fund size is $750 million for SnCF.', 'pageOrSection': 'Page 6', 'sourceName': 'annual performance', 'evidenceKind': 'quantitative'}, {'field': 'primaryFunderAmountUsd', 'claim': 'The total Green Climate Fund funding is 150 million USD.', 'pageOrSection': 'Page 14', 'sourceName': 'annual performance', 'evidenceKind': 'quantitative'}, {'field': 'financingStructure', 'claim': 'No grants have been disbursed by the GCF for this project. Private co-financing of USD 600 million targeted.', 'pageOrSection': 'Pages 14, 21', 'sourceName': 'annual performance', 'evidenceKind': 'quantitative'}, {'field': 'totalEmissionReductionTco2e', 'claim': 'Expected lifetime emission reductions: 77,634,432 tCO2e.', 'pageOrSection': 'Page 13', 'sourceName': 'annual performance', 'evidenceKind': 'quantitative'}, {'field': 'estimatedBeneficiaryCount', 'claim': 'Final target is to reach 17,000,000 indirect beneficiaries.', 'pageOrSection': 'Page 15', 'sourceName': 'annual performance', 'evidenceKind': 'quantitative'}]","Country code inferred as CI; sector set to 'policy' and subsector as 'climate_investment_fund' due to absence of specific project technology and multiple sectors targeted. Total emission reduction lifetime target taken from the largest value stated (77.6M tCO2e, Page 13); another target (8.99M tCO2e, Page 15) appears to be for initial investments. Financing structure percentages based on $150M GCF (junior equity) and $600M private sector (senior equity) out of $750M target. No specific co-financier entities identified in evidence. No project or subproject geographic, infrastructure, or specific sectoral (e.g., renewable energy, waste) context detailed at this stage. Capacity and IRR/NPV data are not available in current evidence.",,,,,,0,0,0.8,,"GCF provides $150M in equity (first loss tranche); $600M in co-financing (private and possibly DFI) targeted as senior equity. No grants or loans disbursed. Co-financing is primarily private sector via senior interests (Page 8-9, annual performance).",FALSE,TRUE,TRUE,FALSE,TRUE,"['capacityOrScale', 'capacityValue', 'capacityUnit', 'expectedEmissionReductionTco2ePerYear', 'irr', 'npvUsd', 'verifiedEmissionReductionTco2e', 'accountingPeriodYears', 'region', 'city', 'siteContext.geography', 'siteContext.resourceConditions', 'siteContext.infrastructureContext', 'siteContext.environmentalConditions']",https://www.greenclimate.fund/sites/default/files/document/fp152-annual-performance-report-cy2021-v.pdf,https://www.greenclimate.fund/project/FP152
