P095171,Integrated Health and Water Management Project (SWAP),world_bank,World Bank,Federative Republic of Brazil,BR,Bahia,,programmatic,['technical_assistance'],water,water_supply,,2010-11-02 0:00:00,2017-10-31 0:00:00,completed,"increase from 32,295 to 72,295 people served by simplified water supply and basic sanitation; construct from 161 to 361 simplified water supply systems; up to 1019 rural sanitary pilot modules",72295,people,60000000,60000000,senior_loan,[],,,,,,,,,"At project start, 32,295 people were served by simplified water supply and basic sanitation in at least 10 prioritized municipalities; 161 simplified water supply systems were operational and 19 rural sanitary pilot modules existed; post-neonatal morbidity and mortality due to diarrhea in children under one year and neonatal mortality in 45 selected hospitals were high.",,"[{'action': 'Increase number of people served by simplified water supply and basic sanitation in at least 10 selected municipalities', 'scale': 'increase from 32,295 to 72,295 people', 'status': 'planned'}, {'action': 'Construct and operate simplified water supply systems', 'scale': 'increase from 161 to 361 systems', 'status': 'planned'}, {'action': 'Construct rural sanitary pilot modules', 'scale': 'increase from 19 to 1019 modules', 'status': 'planned'}, {'action': 'Train community voluntary agents', 'scale': 'increase from 43 to 772 agents', 'status': 'planned'}, {'action': 'Approve and ratify River Basin Plans', 'scale': '8 plans', 'status': 'planned'}, {'action': 'Establish operational CERB Geographic Information System Unit and update state map for disease and water systems', 'scale': '1 unit established', 'status': 'planned'}]","Preparation and approval of 8 River Basin Plans, ratification by CONERH, potentially influencing water resource regulation within project municipalities.",Secretaria da Fazenda do Estado da Bahia (SEFAZ) as main borrower and implementing agency; involvement of three secretariats for management certification.,"People in at least 10 selected municipalities in Bahia, especially children under five, hospital patients, rural residents, and local officials.",72295,['public_health'],"The Integrated Health and Water Management Project (SWAP) in Bahia, Brazil, sought to reduce infant morbidity and mortality by upgrading water supply and sanitation infrastructure, expanding public health actions, and modernizing government management systems. The project targeted an increase in people with access to improved water and sanitation, construction of rural sanitary modules, approval of river basin plans, and building local capacity via training. Implementation focused on at least 10 municipalities and hospital system support, as well as technical and institutional strengthening.","['Expansion of simplified water supply systems', 'Construction of rural sanitary modules', 'Technical assistance for hospital/health system improvement', 'River basin planning and approval', 'Training of community agents', 'Institutional modernization']",[],"['Presence of underserved rural municipalities', 'Ability to organize and train local voluntary agents', 'State or local institutions available for coordinated health and water sector interventions']",,"[{'field': 'totalBudgetUsd', 'claim': 'The total commitment amount and project cost are 60 million USD.', 'pageOrSection': 'Page 7', 'sourceName': 'Implementation Status and Results Report', 'evidenceKind': 'quantitative'}, {'field': 'primaryFunderAmountUsd', 'claim': 'The World Bank loan of 60 million USD comprises the entire project financing.', 'pageOrSection': 'Page 7', 'sourceName': 'Implementation Status and Results Report', 'evidenceKind': 'quantitative'}, {'field': 'financingStructure.loan_pct', 'claim': '100% financing by a World Bank loan.', 'pageOrSection': 'Page 7', 'sourceName': 'Implementation Status and Results Report', 'evidenceKind': 'quantitative'}, {'field': 'capacityOrScale', 'claim': 'Target to increase the number of people served by water supply/sanitation from 32,295 to 72,295; construction of 361 water supply systems and 1019 pilot modules.', 'pageOrSection': 'Page 2–3', 'sourceName': 'Implementation Status and Results Report', 'evidenceKind': 'quantitative'}, {'field': 'estimatedBeneficiaryCount', 'claim': 'Target of 72,295 people served by the project in selected municipalities.', 'pageOrSection': 'Page 2', 'sourceName': 'Implementation Status and Results Report', 'evidenceKind': 'quantitative'}]","Region set to 'Bahia' per project scope, not just 'Brazil'. Status set as 'completed' based on catalog status 'Closed'. No evidence for emission reduction or climate MRV. Financing structure is entirely loan-based; no co-financiers indicated. 'programmatic' and 'technical_assistance' both relevant due to mix of infrastructure/service expansion and institutional reforms, thus both listed but 'programmatic' primary. Some targets are planned, not completed, due to evidence being from project baseline/planning stage.",Bahia state; at least 10 selected municipalities; includes rural areas,,Initial infrastructure includes 161 simplified water supply systems and 19 sanitary pilot modules at baseline,,,,1,,,Funding is entirely from a World Bank loan; no evidence for co-financing or government/private share in documentation.,TRUE,FALSE,TRUE,TRUE,TRUE,"['technologyType', 'irr', 'npvUsd', 'expectedEmissionReductionTco2ePerYear', 'totalEmissionReductionTco2e', 'verifiedEmissionReductionTco2e', 'accountingPeriodYears', 'mrvApproach', 'lessonsLearned']",http://documents.worldbank.org/curated/en/902771468742173306/pdf/P0951710ISR0Di022320111298475450710.pdf,https://projects.worldbank.org/en/projects-operations/project-detail/P095171
P095460,Bahia Integrated State Highway Management Project,world_bank,World Bank,Federative Republic of Brazil,BR,Bahia,Salvador,infrastructure,['technical_assistance'],transport,rural_interurban_roads,output_based_road_contracting,2006-11-14 0:00:00,2013-09-30 0:00:00,completed,,,,200000000,100000000,senior_loan,[],,,,"Component budgets: US$166M (state paved road rehab), US$20M (institutional strengthening). The catalog gives a higher total project cost (US$200M). Project financing from World Bank (US$100M) and State of Bahia (US$86M) totals US$186M.",,,,,,,"[{'action': 'Rehabilitation, resurfacing, safety, and environmental rehabilitation of key state paved roads', 'scale': None, 'status': 'completed'}, {'action': 'Institutional strengthening: optimization of transport services, logistics program consolidation, road administration and planning, capacity improvement, design and supervision', 'scale': None, 'status': 'completed'}]","Shift to long-term, output-based road maintenance and rehabilitation contracts; support for public-private partnership models","State of Bahia (borrower) via Secretariat of Infrastructure; implementation by DERBA; coordination with AGERBA, SEI, and DTL as project beneficiaries","State transportation agencies (AGERBA, SEI, DTL), users of key state roads, transport/logistics sector, semi-arid region communities",,"['jobs', 'economic_growth', 'poverty_reduction', 'regional_equity']","The Bahia Integrated State Highway Management Project, implemented in the State of Bahia, Brazil, rehabilitated and maintained state paved roads and strengthened institutional capacity for road management. It aimed to reduce transport costs, improve infrastructure use, and integrate the semi-arid region into the economy. The project was managed by DERBA and supported by the World Bank and the State of Bahia.","['Rehabilitation and maintenance of key paved road sections (Component 1)', 'Institutional strengthening of road management and planning (Component 2)', 'Introduction of long-term, output-based maintenance and rehabilitation contracts', 'Environmental rehabilitation and safety improvements on road network', 'Implementation of the Transport Logistics State Program (PELTBAHIA)']","[{'type': 'resource', 'risk': 'Potential for continued road deterioration due to insufficient maintenance funding'}, {'type': 'capacity', 'risk': 'Need for strengthened technical and administrative capacity within DERBA and other agencies'}, {'type': 'market', 'risk': 'Private sector resource allocation for long-term output-based contracts may face challenges'}]","['Presence of a state or regional road agency capable of managing large infrastructure projects', 'Ability to implement output-based, long-term contracts for road maintenance', 'Institutional capacity for planning, engineering design, and public-private partnerships', 'Strategic integration of transport corridors linked to economic development zones']",,"[{'field': 'totalBudgetUsd', 'claim': 'Total project cost is $200 million (from catalog).', 'pageOrSection': 'catalog_record', 'sourceName': 'World Bank catalog', 'evidenceKind': 'quantitative'}, {'field': 'primaryFunderAmountUsd', 'claim': 'US$100 million commitment from IBRD (World Bank) as per both evidence and catalog.', 'pageOrSection': 'Page 7', 'sourceName': 'Project Information Document', 'evidenceKind': 'quantitative'}, {'field': 'financingStructure', 'claim': 'Breakdown: US$100M IBRD, US$86M borrower. Percentages: 53.76% loan, 46.24% government.', 'pageOrSection': 'Page 7', 'sourceName': 'Project Information Document', 'evidenceKind': 'quantitative'}]","Region is explicitly specified as Bahia by project scope, not the World Bank's regional grouping. Total project cost per catalog is US$200M, but financing details in evidence sum to US$186M, suggesting a possible unfunded share or discrepancy; the most complete quantitative value is used as total, with notes on alternative numbers. No specific capacity or GHG data reported. Co-financiers are not explicitly mentioned besides the World Bank and borrower.","State of Bahia, including urban (Salvador) and regional corridors, with semi-arid regions",Road network in poor condition from historic underinvestment; major transport corridors; subject to heavy vehicle loads from traffic diversion,"State-administered road network, federal-state coordination, presence of DERBA, need for extensive maintenance and rehabilitation",Semi-arid regional characteristics,Emphasis on integrating semi-arid regions and improving road logistics to support state economic growth,,0.5376,,0.4624,"US$100M from IBRD (World Bank), US$86M from borrower per evidence; percentage values derived from US$186M total.",FALSE,FALSE,TRUE,TRUE,TRUE,"['capacityValue', 'capacityUnit', 'expectedEmissionReductionTco2ePerYear', 'totalEmissionReductionTco2e', 'verifiedEmissionReductionTco2e', 'accountingPeriodYears', 'estimatedBeneficiaryCount', 'irr', 'npvUsd', 'paymentPerTco2eUsd', 'lessonsLearned']",http://documents.worldbank.org/curated/en/839211468006922299/pdf/Project0Inform1aisal0Stage012114105.pdf,https://projects.worldbank.org/en/projects-operations/project-detail/P095460
P095626,Second Family Health Extension Adaptable Lending,world_bank,World Bank,Federative Republic of Brazil,BR,,,programmatic,[],policy,primary_health_care_extension,,2008-04-25 0:00:00,2014-12-31 0:00:00,completed,"Coverage expansion to 177 municipalities (>100,000 inhabitants each)",177,municipalities,166700000,83450000,senior_loan,[],,,,Project funded through Adaptable Program Lending (APL) investment project financing and utilized a SWAp (Sector-Wide Approach) method to distribute funds to municipalities and states.,,,,,,,"[{'action': 'Rehabilitation and upgrading of basic health care units', 'scale': None, 'status': 'completed'}, {'action': 'Scaling up Family Health Program coverage in urban centers', 'scale': '177 municipalities (>100,000 inhabitants each)', 'status': 'completed'}, {'action': 'Strengthening family health human resources through targeted training and education', 'scale': None, 'status': 'completed'}, {'action': 'Implementation and institutionalization of monitoring and evaluation systems for family health', 'scale': None, 'status': 'completed'}, {'action': 'Upgrade of Basic Care information system (SIAB)', 'scale': None, 'status': 'completed'}]",Revision of federal monitoring indicators for municipal performance and piloting results-based management and financing mechanisms.,"Implemented by Ministry of Health - Department of Primary Care (Departamento de Atenção Básica - DAB), with municipalities as fund recipients in a SWAp framework.","Residents in targeted municipalities, especially those in urban areas and low-income communities.",,"['public_health', 'health_system_strenghtening', 'improved_medical_waste_management']","The Second Family Health Extension Adaptable Lending project in Brazil expanded affordable, primary health care services to 177 large municipalities, focusing on improving quality, accessibility, and monitoring. Implemented by the Ministry of Health, the project financed rehabilitation of health facilities, strengthened human resources, and improved health management systems through results-based financing and monitoring reforms.","['Expansion and rehabilitation of primary health facilities', 'Capacity building for family health workers', 'Systematic monitoring and evaluation of family health performance', 'Upgrading of health management information systems (SIAB)', 'Piloting results-based management and financing models']","[{'type': 'governance', 'risk': 'Substantial disparities across regions, income groups, and urban/rural split could limit equitable impact.'}, {'type': 'capacity', 'risk': 'Sustainability of improvements depends on strengthened municipal management and ongoing staff development.'}, {'type': 'environmental', 'risk': 'Expansion of services may increase waste generation at health units, requiring improved controls.'}]","['Existing national and municipal health infrastructure', 'Capacity to channel funds through a SWAp approach to local governments', 'Institutional ability for monitoring, evaluation, and information system upgrades']",,"[{'field': 'totalBudgetUsd', 'claim': 'The total project cost is US$166.7 million.', 'pageOrSection': 'catalog record', 'sourceName': 'World Bank catalog', 'evidenceKind': 'quantitative'}, {'field': 'primaryFunderAmountUsd', 'claim': 'World Bank total commitment is US$83.45 million.', 'pageOrSection': 'catalog record', 'sourceName': 'World Bank catalog', 'evidenceKind': 'quantitative'}, {'field': 'capacityOrScale', 'claim': 'Project expanded support to 177 municipalities each with more than 100,000 inhabitants.', 'pageOrSection': 'Page 2', 'sourceName': 'Project Information Document', 'evidenceKind': 'quantitative'}]","There is a minor conflict between catalog and evidence on total project financing: the catalog states the project cost as $166.7M and commitment as $83.45M, while the Project Information Document suggests a tentative $242M split evenly between the borrower and IBRD. Catalog amounts are used for consistency. Sector is mapped to 'policy' since the project is a national-scale primary health extension program involving system reform, institutional capacity, and monitoring—not direct infrastructure or physical asset buildout.","National coverage, with a focus on large urban municipalities",,"Rehabilitation of basic health care units, improved health information systems",,"Disparities in health status and access exist between urban and rural, and among regions and municipalities.",,,,,World Bank commitment $83.45M; evidence suggests cost-sharing between borrower and World Bank.,TRUE,FALSE,FALSE,TRUE,TRUE,"['region', 'city', 'irr', 'npvUsd', 'expectedEmissionReductionTco2ePerYear', 'totalEmissionReductionTco2e', 'verifiedEmissionReductionTco2e', 'paymentPerTco2eUsd', 'estimatedBeneficiaryCount', 'baselineDescription', 'mrvApproach']",http://documents.worldbank.org/curated/en/762071468016253650/pdf/Project0Inform1ment010Concept0Stage.pdf,https://projects.worldbank.org/en/projects-operations/project-detail/P095626
P096337,Reforestation with Native Species around AES-Tiete Reservoirs,world_bank,World Bank,Federative Republic of Brazil,BR,São Paulo state,,programmatic,[],land_use_forestry,reforestation,native_species_reforestation,2010-09-29 0:00:00,2014-12-31 0:00:00,completed,"2,500 ha reforested with 80–126 native species",2500,hectares,27250000,0,results_based_payment,[],,,,"BioCarbon Fund purchases up to 400,000 Emission Reductions (ERs); carbon revenue directly supports reforestation activity. No direct World Bank financial commitment.",,400000,,,"The project area consisted of unmanaged grasslands and expropriated APP strips around 10 AES-Tietê reservoirs that had not resumed natural forest regeneration, and would remain as open grassland without intervention.",AR-AM0010 afforestation/reforestation methodology pilot; satellite imagery and carbon sequestration monitoring protocols developed,"[{'action': 'Reforestation of degraded riparian and grassland areas with native species', 'scale': '2,500 ha of native riparian forests using 80–126 species', 'status': 'completed'}, {'action': 'Testing and implementation of AR-AM0010 methodology for A/R in protected grasslands', 'scale': None, 'status': 'completed'}]",Confirmed enforcement of legal protection status for APPs: designation of up to 100m from reservoir waterline as permanent preservation area prohibits commercial/productive activities.,"AES-Tietê owns and operates all project land, leads implementation, and prepared Environmental Assessment and Management Plan; BioCarbon Fund as carbon purchaser; engagement of 92 municipalities, environmental agencies, and scientific community.","Local biodiversity, water resources, scientific community, and indirectly, populations of 92 municipalities adjacent to reservoirs.",,"['biodiversity', 'water_quality']","This project in São Paulo state, Brazil, reforested about 2,500 hectares of degraded grasslands and riparian zones around ten AES-Tietê hydropower reservoirs using 80–126 native tree species. Financed through the BioCarbon Fund via results-based carbon payments, the project aimed to generate 400,000 Emission Reductions while delivering biodiversity corridors and water quality improvements. All areas were legally protected as permanent preservation areas, and reforestation methods and carbon monitoring protocols were developed and piloted.","['Reforestation of 2,500 ha in APPs around 10 reservoirs', 'Establishment of native riparian forests with high species diversity', 'Pilot of AR-AM0010 carbon methodology', 'Environmental monitoring and management', 'Pest and invasive species control (e.g., leaf-cutter ant management for 2-3 years)']","[{'type': 'resource', 'risk': 'Failure of natural regeneration and need for active intervention in grasslands'}, {'type': 'environmental', 'risk': 'Temporary localized impacts from herbicide/pesticide use during initial years'}, {'type': 'reversal', 'risk': 'Potential for invasive species or pest outbreaks affecting seedling survival'}]","['Large contiguous areas of legal permanent preservation status (APPs)', 'Ownership or control of land allowing exclusive use for conservation', 'Availability of local knowledge in native species reforestation', 'Access to satellite imagery for delineation and monitoring', 'Exclusion of areas with rocky soils, illegal occupations, and existing forest patches']",Natural regeneration may not occur even in legally protected areas; active reforestation and tailored management practices are required to achieve restoration and carbon goals. Results-based carbon finance can enable otherwise financially unviable ecosystem restoration.,"[{'field': 'totalBudgetUsd', 'claim': 'The total project cost is $27,250,000', 'pageOrSection': 'catalog', 'sourceName': 'World Bank project catalog', 'evidenceKind': 'quantitative'}, {'field': 'primaryFunderAmountUsd', 'claim': 'World Bank commitment amount is $0', 'pageOrSection': 'catalog', 'sourceName': 'World Bank project catalog', 'evidenceKind': 'quantitative'}, {'field': 'capacityValue', 'claim': 'Project involves reforesting at least 2,500 hectares with native species', 'pageOrSection': 'Page 1', 'sourceName': 'Integrated Safeguards Data Sheet', 'evidenceKind': 'quantitative'}, {'field': 'totalEmissionReductionTco2e', 'claim': 'Project plans to generate and sell 400,000 ERs to BioCF', 'pageOrSection': 'Page 1', 'sourceName': 'Integrated Safeguards Data Sheet', 'evidenceKind': 'quantitative'}]","Region set as São Paulo state based on description of 10 reservoirs and multiple municipalities. Sector and subsector assigned from strong evidence of reforestation using native species in legal APPs. Commitment amount for primary funder (World Bank) recorded as $0 as per catalog, with financing from BioCarbon Fund. Emission reduction value based on 400,000 ERs to be sold; a larger potential of 4.3 million ERs and a broader eligible area are mentioned as future/expansion, not the specific pilot under this project. Beneficiary count is not stated; only broad categories of primary beneficiaries are inferred. Actions combine quantitative and categorical evidence. No city specified, as project is spread over 92 municipalities.",Riparian zones and expropriated grasslands adjacent to 10 hydropower reservoirs in São Paulo state,Unmanaged grasslands and degraded riparian areas within permanent preservation areas (APPs) that have not naturally regenerated,"Adjacent to major hydropower reservoirs; expropriated, legally protected strips (at least 30m, up to 100m from waterline); AES-Tietê ownership/control",Located in Atlantic Forest and Cerrado biomes; previous lack of natural regeneration; localized temporary impacts from herbicide/pesticide use,"Project areas determined by satellite imagery; exclusion of rocky soils, illegal occupation, water bodies, and existing forest patches",,,,,Financed via BioCarbon Fund; no typical World Bank loan or grant commitment,TRUE,TRUE,TRUE,TRUE,TRUE,"['expectedEmissionReductionTco2ePerYear', 'verifiedEmissionReductionTco2e', 'accountingPeriodYears', 'paymentPerTco2eUsd', 'city', 'estimatedBeneficiaryCount', 'irr', 'npvUsd']",http://documents.worldbank.org/curated/en/344921468226170512/pdf/536710PID0BR0reforestation0rev.pdf,https://projects.worldbank.org/en/projects-operations/project-detail/P096337
