CH-L1168,Program to Support the Development of the Green Hydrogen Industry in Chile,idb,Inter-American Development Bank,Chile,CL,,,programmatic,"['technical_assistance', 'blended']",renewable_energy,green_hydrogen,green_hydrogen_electrolysis,2023-06-07 0:00:00,,under_implementation,"314 MW of electrolysis capacity by project end; supporting green hydrogen production targets of 805.05 MW by 2028/2030 and 19,709 tons GH2/year by 2028",314,MW,400000000,400000000,senior_loan,[],0.1301,39400000,,"Results-based disbursement structure. Up to US$1,166.5 million in private investment mobilization is projected outside IDB funding.",,,,,"Annual GHG emissions from fuel combustion in Chile were 88.6 million tCO2e in 2021, with reduction targets to 75 million by 2028 and 60 million by 2033.",Synthetic control methodology to evaluate causal impacts on installed electrolysis capacity and CO2 reductions; monitored with International Energy Agency and Ministry of Energy data.,"[{'action': 'Support investment in green hydrogen production and derivatives projects', 'scale': 'US$350 million allocated; 14 projects with environmental approval or pending by close', 'status': 'in_progress'}, {'action': 'Develop public goods and sector inputs (standards, protocols, forums)', 'scale': '31 public goods developed', 'status': 'in_progress'}, {'action': 'Promote innovation and entrepreneurship in GH2 value chain', 'scale': 'About 100 R&D projects, direct support to at least 165 young companies', 'status': 'in_progress'}, {'action': 'Train human capital including scholarships and skills-building', 'scale': '2840 people in training, 500 scholarships, 2300 in training activities', 'status': 'in_progress'}, {'action': 'Establish sector institutions (GH2 Committee, environmental/social management team, data intelligence unit)', 'scale': 'GH2 Committee and sustainability team operational', 'status': 'in_progress'}]",Supports the 2020 National Green Hydrogen Strategy. Policy actions include pursuit of emission-free electricity by 2050 and need for GH2-specific regulation.,Execution by CORFO (Corporación de Fomento de la Producción). Ministry of Economy is liaison. GH2 Committee created for sector coordination.,"Companies and startups investing in green hydrogen and its derivatives, research and innovation centers, individuals receiving training and scholarships.",2840,"['jobs', 'innovation', 'gender_equality', 'capacity_building']","The program, funded by a US$400 million IDB loan, aims to accelerate the development of Chile's green hydrogen industry by mobilizing private investment, enhancing public inputs, and fostering domestic demand. Key interventions include direct support for GH2 projects, sector innovation, public goods development, and human capital training. The project is expected to generate significant electrolysis capacity, support hundreds of companies and individuals, and promote the decarbonization of Chile’s economy.","['Direct financing and credit guarantees for GH2 projects', 'Support for electrolyzer plant procurement and installation', 'Development of sector public goods and standards', 'Innovation and entrepreneurship funding and promotion', 'Human capital and skills development programs', 'Institutional strengthening and sector governance (GH2 Committee, data intelligence)']","[{'type': 'market', 'risk': 'High GH2 price limits adoption in short term'}, {'type': 'resource', 'risk': 'Uncertainty in long-term technology cost and operational performance'}, {'type': 'regulatory', 'risk': 'Lack of dedicated GH2 regulation; currently classified as industrial gas, not fuel'}, {'type': 'governance', 'risk': 'Financial system underdevelopment for bankable GH2 projects'}]","['High solar irradiance or wind resource availability', 'Access to renewable electricity supply', 'Existing or planned grid connection near project sites', 'Institutional capacity to coordinate multisector public/private partnerships', 'Willingness to invest in sector-specific public goods (standards, safety, innovation support)']",Public input and sector public goods are crucial to accelerate private investment and deployment in new strategic sectors like green hydrogen.,"[{'field': 'primaryFunderAmountUsd', 'claim': 'IDB is financing the project with a loan of US$400 million.', 'pageOrSection': 'Page 5 – PROJECT SUMMARY', 'sourceName': 'Loan Proposal', 'evidenceKind': 'quantitative'}, {'field': 'totalBudgetUsd', 'claim': 'The total project cost is US$400 million.', 'pageOrSection': 'Page 5 – PROJECT SUMMARY', 'sourceName': 'Loan Proposal', 'evidenceKind': 'quantitative'}, {'field': 'capacityOrScale', 'claim': 'The project expects to gain 314 MW of electrolysis capacity by project end.', 'pageOrSection': 'Page 26', 'sourceName': 'Loan Proposal', 'evidenceKind': 'quantitative'}, {'field': 'irr', 'claim': 'The economic analysis over 15 years shows an IRR of 13.01%', 'pageOrSection': 'Page 17', 'sourceName': 'Loan Proposal', 'evidenceKind': 'quantitative'}, {'field': 'npvUsd', 'claim': 'The economic analysis over 15 years shows an NPV of US$39.4 million.', 'pageOrSection': 'Page 17', 'sourceName': 'Loan Proposal', 'evidenceKind': 'quantitative'}, {'field': 'actionsImplemented', 'claim': 'Component 1 involves supporting investments in GH2 projects; Component 2 supports sector public goods, innovation, training, and institution-building.', 'pageOrSection': 'Pages 14–16, 17, 26, 29', 'sourceName': 'Loan Proposal', 'evidenceKind': 'quantitative, qualitative'}, {'field': 'estimatedBeneficiaryCount', 'claim': '2,840 people will be enrolled or participating in training by project end.', 'pageOrSection': 'Page 26', 'sourceName': 'Loan Proposal', 'evidenceKind': 'quantitative'}]","Emission reduction values (tCO2e) are not quantified in available evidence—targets are set at the national fuel combustion level, not by project. Private investment mobilization (US$1,166.5M) is a target but is not a confirmed co-financing input. 'Programmatic' is chosen as project type due to multi-component sector support, with technical assistance and blended approaches present. Some capacity and beneficiary numbers may overlap, but training and innovation figures are reported as distinct in the evidence.",national scope; production hubs in Antofagasta Region and Magallanes and Chilean Antarctica Region,high solar irradiance in the north; strong wind resources in the south,existing grid access in main industrial regions; renewable electricity (45% of mix); limited bankable financial products; no specific GH2 regulation,need for environmental and biodiversity studies; cumulative impact analysis planned,,,1,,,All IDB resources provided as sovereign loan; additional CORFO/ANID subsidies and private mobilization not included in this field.,TRUE,FALSE,TRUE,TRUE,TRUE,"['expectedEmissionReductionTco2ePerYear', 'totalEmissionReductionTco2e', 'verifiedEmissionReductionTco2e', 'accountingPeriodYears', 'closingDate', 'paymentPerTco2eUsd']",https://www.iadb.org/document.cfm?id=EZIDB0000158-529543059-59,
CH-M1009,Promotion of Clean Energy Market Opportunities,idb,Inter-American Development Bank (IDB),Chile,CL,,,technical_assistance,[],policy,energy_efficiency_policy,energy efficiency and renewable energy business model development,2006-06-14 0:00:00,,completed,3 ESCOs received technical assistance and business plan development,3,ESCOs,1950000,975000,grant,[],0.359,,,"Project used a blend of loan, leasing, and energy performance bonds as available financial tools for ESCO models. Several IRR scenarios were calculated (35.9%–91.8%).",,,,,,It is recommended to allocate 5% of investment budget to measurement and verification of energy savings.,"[{'action': 'Specialized consulting provided to three ESCOs for business plan development', 'scale': '3 ESCOs', 'status': 'completed'}, {'action': 'Preparation of three business plans and a best practices guide for ESCO business plans', 'scale': '3 business plans, 1 guide', 'status': 'completed'}, {'action': 'Workshops and periodic expert meetings for ESCO training and contract best practices', 'scale': None, 'status': 'completed'}]",,Fundación Chile as implementing agency; Econoler as technical consultant for ESCO support,Small and medium enterprise engineering service companies (ESCOs) in Chile,3,"['jobs', 'energy_security']","The project promoted market opportunities for SMEs in Chile by supporting the development and implementation of ESCO (energy service) models to increase renewable energy and energy efficiency adoption. Fundación Chile and Econoler delivered technical assistance and business plan development to three selected engineering service SMEs. Activities included business plan drafting, strategic workshops, and the creation of business planning guides to build ESCO capacity in the Chilean clean energy market.","['Business planning and strategic consulting for ESCOs', 'Development of ESCO business plan guide', 'Workshop on energy performance contract models and local best practices']","[{'type': 'capacity', 'risk': 'Low executive availability in SMEs to dedicate time for business planning'}, {'type': 'governance', 'risk': 'High confidentiality of business plans limited knowledge sharing'}, {'type': 'market', 'risk': 'Distrust among ESCOs regarding applicability of international ESCO models to Chile'}]","['Presence of SME engineering companies interested in ESCO models', 'Access to technical and business planning support for ESCO setup', 'Availability of debt, leasing, or performance bond financing options for energy efficiency projects']","Short project timelines do not align with SME operational realities. Confidentiality in SME planning can hinder results dissemination, and local adaptation of international business models is necessary for successful ESCO uptake.","[{'field': 'totalBudgetUsd', 'claim': 'Total project cost is $1,950,000 USD.', 'pageOrSection': 'catalog', 'sourceName': 'IDB catalog record', 'evidenceKind': 'quantitative'}, {'field': 'primaryFunderAmountUsd', 'claim': 'IDB commitment of $975,000 USD.', 'pageOrSection': 'catalog', 'sourceName': 'IDB catalog record', 'evidenceKind': 'quantitative'}, {'field': 'capacityOrScale', 'claim': 'Three engineering service SMEs were selected as beneficiary ESCOs.', 'pageOrSection': 'Page 3', 'sourceName': 'MIF Project Product', 'evidenceKind': 'categorical'}, {'field': 'financingStructure.loan_pct', 'claim': '70% of project financing was structured as debt (including various forms).', 'pageOrSection': 'Page 26', 'sourceName': 'MIF Project Product', 'evidenceKind': 'categorical'}, {'field': 'irr', 'claim': 'IRR before taxes is 35.9%.', 'pageOrSection': 'Page 26', 'sourceName': 'MIF Project Product', 'evidenceKind': 'quantitative'}, {'field': 'mrvApproach', 'claim': 'Best practice is to allocate 5% of investment cost for measurement and verification (M&V).', 'pageOrSection': 'Page 84', 'sourceName': 'MIF Project Product', 'evidenceKind': 'quantitative'}, {'field': 'actionsImplemented', 'claim': 'Consulting resulted in three business plans and a guide for ESCO business plans, with capacity-building activities.', 'pageOrSection': 'Pages 3–5, 12', 'sourceName': 'MIF Project Product', 'evidenceKind': 'qualitative'}, {'field': 'estimatedBeneficiaryCount', 'claim': 'Three ESCOs were direct beneficiaries.', 'pageOrSection': 'Page 3', 'sourceName': 'MIF Project Product', 'evidenceKind': 'quantitative'}]","No emission reduction values are given in evidence. IRR values vary (35.9%, 61.2%, 91.8%)—lowest value reported; 70% loan figure is for project financing to ESCOs, not the IDB grant. No region or city detail is available. The grant/loan split for the overall project budget is not fully specified, so financing structure for the project as a whole is partially inferred. Catalog record gives country code as 'CH' (should be 'CL' for Chile).",,,,,,,0.7,,,"70% debt financing structure referenced (includes short/long term loans, leasing, bonds); actual grant/loan split for overall project is not specified.",TRUE,FALSE,TRUE,FALSE,TRUE,"['closingDate', 'expectedEmissionReductionTco2ePerYear', 'totalEmissionReductionTco2e', 'verifiedEmissionReductionTco2e', 'baselineDescription', 'accountingPeriodYears', 'siteContext.geography', 'siteContext.resourceConditions', 'siteContext.infrastructureContext', 'siteContext.environmentalConditions']",https://www.iadb.org/document.cfm?id=EZSHARE-565651809-613,
CH-T1043,Support for Energy Efficiency Country Program (EECP),idb,IDB,Chile,CL,,,technical_assistance,[],policy,energy_efficiency_framework,,2007-11-02 0:00:00,,completed,,,,1000000,500000,grant,[],,,,"All funding is provided as non-reimbursable technical cooperation (grant), split between IDB (Infrafund) and local government. Some component budgets detailed, but not used for total project funding figures.",,,,,,,"[{'action': 'Development of national strategic and regulatory frameworks for energy efficiency', 'scale': None, 'status': 'completed'}, {'action': 'Design and implementation of incentive and financing programs for technology replacement in sectors such as industry, mining, vehicles, public lighting, and buildings', 'scale': None, 'status': 'completed'}, {'action': 'Planning, management, and preparation of studies for pilot and demonstration activities in public and private sectors', 'scale': None, 'status': 'completed'}, {'action': 'Development and support for minimum standard-setting for industrial/home appliances and regulatory barriers removal', 'scale': None, 'status': 'completed'}, {'action': 'Outreach, certification, education, and training activities to promote energy efficiency', 'scale': None, 'status': 'completed'}]","Development of energy efficiency legal and regulatory framework, introduction of minimum standards for home and industrial appliances, and groundwork for an Energy Efficiency Law (in drafting).","PPEE Commission chaired by Ministry of Economy with Consultative and Operative Committees involving key state institutions, private sector, local governments, and civil society. Performance Agreements established with ministries/state institutions. Executing agency: PPEE/Ministry of Economy, with Infrafund support.","Ministry of Economy, Development, and Reconstruction of Chile and indirectly all sectors addressed by the national energy efficiency program",,"['energy_security', 'competitiveness', 'air_quality', 'public_health', 'social_equity']","This technical cooperation supported the Government of Chile, via the Ministry of Economy, in designing and implementing the strategic, legal, and regulatory frameworks necessary for a comprehensive national energy efficiency program. Activities focused on overcoming regulatory barriers, developing baselines and indicators, establishing minimum equipment standards, and enabling technology replacement across key sectors such as industry, mining, transport, services, and housing. The program also fostered public-private collaboration, capacity building, and dissemination activities.","['Design of logical and strategic program frameworks', 'Drafting of energy efficiency legal and regulatory framework', 'Development of minimum standards for industrial and home appliances', 'Promotion of clean development mechanisms and carbon finance', 'Integrated public procurement and energy management in buildings', 'Thermal refurbishment of homes and certification for new housing', 'Labeling and standards for appliances, vehicles, and fleets', 'Public outreach, education, and training activities', 'Design of financial and incentive mechanisms for technology replacement']","[{'type': 'governance', 'risk': 'Effective coordination and sustained commitment among ministries and agencies needed for successful implementation'}, {'type': 'capacity', 'risk': 'Capacity for implementation and management in target sectors may be limited without ongoing support'}]","['Strong central government leadership and convening capacity', 'Existence of a national program or commission with cross-ministry mandate', 'Willingness and capacity for public-private collaboration', 'Availability of domestic co-financing for technical cooperation activities']",,"[{'field': 'totalBudgetUsd', 'claim': 'The project is financed with a total of US$1,000,000: US$500,000 Project Preparation Fund and US$500,000 local.', 'pageOrSection': 'Page 1 – I. INFORMACIÓN BÁSICA DEL PROYECTO', 'sourceName': 'TC Brief', 'evidenceKind': 'quantitative'}, {'field': 'primaryFunderAmountUsd', 'claim': 'The project is financed with a total of US$1,000,000; US$500,000 from the Project Preparation Fund and US$500,000 local funding.', 'pageOrSection': 'Page 1 – I. INFORMACIÓN BÁSICA DEL PROYECTO', 'sourceName': 'TC Brief', 'evidenceKind': 'quantitative'}, {'field': 'financingStructure', 'claim': 'US$1,000,000 total, with US$500,000 from Infrafund and US$500,000 from counterpart sources (i.e., 50% grant, 50% local government).', 'pageOrSection': 'Page 6', 'sourceName': 'TC Brief', 'evidenceKind': 'quantitative'}, {'field': 'siteContext', 'claim': 'Chile is highly dependent on imported energy (72%) and has growing energy demand, with multiple sectors including industry, mining, and housing targeted for efficiency programs.', 'pageOrSection': 'Page 1 – II. OBJETIVOS', 'sourceName': 'TC Brief', 'evidenceKind': 'quantitative'}]","All financing is non-reimbursable technical cooperation (grant), confirmed by multiple atoms. Project is technical assistance for policy and preparatory work; no direct emissions reductions or capacity figures reported. No region, city, or beneficiary count provided; closing date not stated in evidence. Subsector assigned as 'energy_efficiency_framework' as the project centers on national program/policy and standards. Actions refer to framework and capacity-building, not infrastructure implementation.","national, Chile","High dependence on imported energy (72% of energy consumed is imported), growing energy demand (+7.6% annual growth over last decade)","Relevant to multiple sectors: industry, mining, services, public buildings, housing; public procurement systems and national government ministries engaged",,,0.5,0,0,0.5,"50% funding from IDB Project Preparation Fund (Infrafund grant), 50% from local Chilean government sources",FALSE,FALSE,TRUE,TRUE,TRUE,"['capacityOrScale', 'capacityValue', 'capacityUnit', 'expectedEmissionReductionTco2ePerYear', 'totalEmissionReductionTco2e', 'verifiedEmissionReductionTco2e', 'accountingPeriodYears', 'baselineDescription', 'mrvApproach', 'estimatedBeneficiaryCount', 'closingDate']",https://www.iadb.org/document.cfm?id=EZSHARE-1379214296-29,
CH-T1217,REDD Chain Project,idb,IDB,Chile,CL,,,programmatic,['technical_assistance'],land_use_forestry,redd_plus,AI-enabled satellite monitoring platform,2019-07-08 0:00:00,,completed,3 TB of Sentinel-2 satellite data processed,3,TB,2205450,825000,grant,['South Pole Carbon Asset Management Ltd.'],,,,,,,,,,Pilot of an AI-powered monitoring system leveraging satellite data and integration of official forest/land-use records for transparent reporting and tracking.,"[{'action': 'Development and deployment of REDD Chain Pilot platform including web dashboard and forest management service', 'scale': None, 'status': 'completed'}, {'action': 'Integration of CONAF data (including deforestation records) and 3TB of Sentinel-2 satellite data', 'scale': '3 TB of satellite data', 'status': 'completed'}, {'action': 'Pilot extension activities assessing results-based payment and other market mechanisms', 'scale': None, 'status': 'in_progress'}, {'action': 'Development and deployment of additional machine learning models for forest management', 'scale': None, 'status': 'completed'}, {'action': 'Strategy development for scalable biodiversity evaluation technologies', 'scale': None, 'status': 'completed'}]",,"Implemented by South Pole Carbon Asset Management Ltd., in collaboration with Chilean Government (CONAF) and research support from DS3 Lab (ETH Zurich).",Government of Chile (CONAF) and public institutions tasked with land-use and forest ecosystem monitoring,,['biodiversity'],"The REDD Chain Project in Chile piloted exponential technologies for monitoring and evaluation of forest ecosystems and land use. It developed and deployed an AI-powered platform processing large satellite datasets, integrated official government data, and enabled improved national reporting and potential results-based investment mechanisms. The project featured strong collaboration with public agencies and research institutions, and advanced biodiversity monitoring strategies to facilitate compliance with national and market-linked requirements.","['Development of REDD Chain AI-enabled monitoring platform', 'Integration of satellite (Sentinel-2) and official (CONAF) land-use data', 'Deployment of machine learning models for forest and deforestation detection', 'Biodiversity offset strategy preparation', 'Pilot for results-based payment mechanism for land-use interventions']","[{'type': 'capacity', 'risk': 'Delays and adaptations required due to challenges with AI model training, third-party data labeling providers, and COVID-19 travel restrictions'}, {'type': 'governance', 'risk': 'Integration of diverse data formats and acquisition of official data required extensive institutional cooperation'}]","['Availability of large-scale satellite imagery (e.g., Sentinel-2)', 'Access to official land-use and deforestation data from relevant government agencies', 'Institutional collaboration with agencies like CONAF', 'Infrastructure for web-based dashboards and large data pipelines']","Alternative datasets and adaptive project management mitigated delays related to contract and data labeling disruptions. Strong partner engagement enabled integration of official government data, and early publication of research supported broader knowledge sharing.","[{'field': 'capacityOrScale', 'claim': 'Handling 3TB of Sentinel-2 satellite data for scalable platform foundation', 'pageOrSection': 'Page 1 – SECCIÓN 2: DESEMPEÑO', 'sourceName': 'Monitoring and Evaluation Plan (during Execution)', 'evidenceKind': 'quantitative'}, {'field': 'totalBudgetUsd', 'claim': 'Total project cost is $2,205,450 USD', 'pageOrSection': 'catalog', 'sourceName': 'catalog', 'evidenceKind': 'quantitative'}, {'field': 'primaryFunderAmountUsd', 'claim': 'IDB total commitment is $825,000 USD', 'pageOrSection': 'catalog', 'sourceName': 'catalog', 'evidenceKind': 'quantitative'}, {'field': 'actionsImplemented', 'claim': 'All planned dashboard features have been implemented in the web-based dashboard.', 'pageOrSection': 'Page 2', 'sourceName': 'Monitoring and Evaluation Plan (during Execution)', 'evidenceKind': 'categorical'}]","No numerical emission reduction data, IRR/NPV, or detailed financing structure breakdown available. 'Programmatic' type inferred due to pilot/technical focus, with technical assistance as a secondary element. Co-financiers only confirmed for South Pole; total budget suggests but does not confirm other sources. Closing date not directly stated, though status 'Closed'; catalog value missing. MRV approach generalized from pilot activities. City/region not specified. Biodiversity listed as co-benefit based on component activities.",Chile (national scope); specific region not indicated,Utilizes Sentinel-2 satellite data and CONAF (Chilean government) forest and deforestation records,"Dependent on data pipelines, web-based dashboard, and cooperation with CONAF and South Pole Carbon Asset Management Ltd.",,The project facilitates digitization and integration of official land-use data for national monitoring.,,,,,No quantitative breakdown; main commitment from IDB with additional funding sources implied by total budget.,TRUE,FALSE,FALSE,TRUE,TRUE,"['closingDate', 'irr', 'npvUsd', 'expectedEmissionReductionTco2ePerYear', 'totalEmissionReductionTco2e', 'verifiedEmissionReductionTco2e', 'accountingPeriodYears', 'baselineDescription', 'estimatedBeneficiaryCount']",https://www.iadb.org/document.cfm?id=EZSHARE-1695404096-11,
